{
  "event_id": "evt_apply_patch_pre_001",
  "event_name": "pre_tool_use",
  "session_id": "sess_colony_omx_lifecycle_v1",
  "agent": "codex",
  "cwd": "/workspace/colony",
  "repo_root": "/workspace/colony",
  "branch": "agent/codex/lifecycle-contract",
  "timestamp": "2026-04-29T10:04:00.000Z",
  "source": "omx",
  "tool_name": "apply_patch",
  "tool_input": {
    "operation": "patch",
    "paths": [
      {
        "path": "packages/contracts/src/index.ts",
        "role": "target",
        "kind": "file"
      }
    ],
    "input_summary": "Patch one TypeScript export file; patch body omitted.",
    "file_count": 1,
    "added_lines": 8,
    "removed_lines": 1,
    "redacted": true
  },
  "result": {
    "status": "ok",
    "code": "CLAIM_PRESENT",
    "message": "Patch target file was claimed before apply_patch.",
    "next_action": "Apply patch and record post_tool_use result.",
    "candidates": []
  }
}
