{
  "event_id": "evt_codex_edit_post_001",
  "parent_event_id": "evt_codex_edit_pre_001",
  "event_name": "post_tool_use",
  "session_id": "sess_colony_omx_lifecycle_v1",
  "agent": "codex",
  "cwd": "/workspace/colony",
  "repo_root": "/workspace/colony",
  "branch": "agent/codex/lifecycle-contract",
  "timestamp": "2026-04-29T10:00:01.000Z",
  "source": "omx",
  "tool_name": "Edit",
  "tool_input": {
    "operation": "replace",
    "paths": [
      {
        "path": "packages/hooks/src/handlers/pre-tool-use.ts",
        "role": "target",
        "kind": "file"
      }
    ],
    "input_summary": "Post-tool result for one sanitized Edit operation.",
    "edit_count": 1,
    "file_count": 1,
    "redacted": true
  },
  "result": {
    "status": "ok",
    "code": "TOOL_RECORDED",
    "message": "PostToolUse linked to its PreToolUse event through parent_event_id.",
    "next_action": "Dedupe repeated event_id deliveries and preserve the parent_event_id link.",
    "candidates": []
  }
}
