{
  "event_id": "evt_codex_write_pre_001",
  "event_name": "pre_tool_use",
  "session_id": "sess_colony_omx_lifecycle_v1",
  "agent": "codex",
  "cwd": "/workspace/colony",
  "repo_root": "/workspace/colony",
  "branch": "agent/codex/lifecycle-contract",
  "timestamp": "2026-04-29T10:01:00.000Z",
  "source": "omx",
  "tool_name": "Write",
  "tool_input": {
    "operation": "write",
    "paths": [
      {
        "path": "packages/contracts/schemas/colony-omx-lifecycle-v1.schema.json",
        "role": "target",
        "kind": "file"
      }
    ],
    "input_summary": "Write a JSON schema file; full file contents omitted.",
    "file_count": 1,
    "byte_count": 6144,
    "redacted": true
  },
  "result": {
    "status": "ok",
    "code": "CLAIM_PRESENT",
    "message": "Target file was claimed before Write.",
    "next_action": "Allow Write and record post_tool_use after completion.",
    "candidates": []
  }
}
